[
  {
    "bug_id": "BUG-001",
    "title": "Boton Search 'disabled' mientras el input contiene texto",
    "severity": "LOW",
    "priority": "P3",
    "status": "NOT_A_BUG",
    "environment": {"url": "https://www.dcshoes.com.ar/", "browser": "OpenCode desktop browser"},
    "preconditions": ["Home cargado"],
    "steps_to_reproduce": ["Cargar Home", "Leer estado inicial del boton", "Tipear 'buzo' en el buscador", "Leer estado inmediatamente", "Leer estado con demora natural", "Clic en el boton"],
    "expected_result": "El usuario puede ejecutar una busqueda con el boton",
    "observed": "Inmediatamente despues de tipear: button.disabled=true. Con demora natural: button.disabled=false y autocomplete abierto. Clic posterior: navega correctamente a /catalogsearch/result/?q=buzo",
    "evidence": ["qa/evidence/dcshoes/TC-006_busqueda.png", "Execution Trace TR-007/TR-008"],
    "possible_cause": "El widget de autocomplete de Magento deshabilita el submit mientras dura la peticion AJAX y lo rehabilita al finalizar (estado transitorio, no persistente)",
    "confidence": "HIGH",
    "notes": "Se descarta como bug: reproducido, medido con y sin demora, y el clic efectivo navego. Estado inicial con input vacio: button.disabled=false."
  },
  {
    "bug_id": "BUG-002",
    "title": "Placeholder '%1' sin reemplazar en mensaje de stock 'Sólo queda %1'",
    "severity": "LOW",
    "priority": "P3",
    "status": "NOT_A_BUG",
    "environment": {"url": "https://www.dcshoes.com.ar/zapatillas-court-graffik-sq-wlk-dc-shoes", "variante": "Color BLANCO / Talle 11"},
    "preconditions": ["Detalle de producto cargado", "Variante cambiada a Talle 11"],
    "steps_to_reproduce": ["Abrir detalle", "Cambiar talle", "Buscar mensajes de stock"],
    "expected_result": "Cantidad de stock mostrada o ausencia de mensaje",
    "observed": "Texto 'Sólo queda <strong>%1</strong>' presente en .availability, pero su contenedor .product-info-stock-sku tiene display:none con rect 0x0 (y contenedores padres tambien display:none). No visible para el usuario.",
    "evidence": ["Lectura DOM con getComputedStyle y getBoundingClientRect (rect 0x0, display none en la cadena de ancestros)"],
    "possible_cause": "Template interno de Magento para stock configurable, renderizado pero oculto por CSS; no llega a ser visible en esta vista",
    "confidence": "HIGH",
    "notes": "No es defecto visible. Queda como OBSERVACION latente: si el contenedor llegara a hacerse visible sin reemplazar %1, seria defecto de presentacion."
  },
  {
    "bug_id": "BUG-003",
    "title": "Campo de cantidad oculto con valor 0 y min=0 en el formulario de compra",
    "severity": "LOW",
    "priority": "P3",
    "status": "NOT_A_BUG",
    "environment": {"url": "https://www.dcshoes.com.ar/zapatillas-court-graffik-sq-wlk-dc-shoes"},
    "preconditions": ["Detalle de producto cargado"],
    "steps_to_reproduce": ["Inspeccionar #qty", "Clic COMPRAR AHORA", "Verificar cantidad en carrito"],
    "expected_result": "Se agrega 1 unidad",
    "observed": "#qty con value=0, min=0, rect 0x0 (oculto). Tras el clic el carrito incorporo correctamente 1 unidad y el contador mostro 1.",
    "evidence": ["qa/evidence/dcshoes/TC-009_contador_carrito.png", "qa/evidence/dcshoes/TC-010_carrito.png"],
    "possible_cause": "Selector de cantidad propio del tema, con input oculto; el backend o JS aplica cantidad por defecto 1",
    "confidence": "MEDIUM",
    "notes": "No se observo comportamiento defectuoso: la cantidad resultante fue 1. Se deja como observacion por configuracion inusual (min=0)."
  }
]
